{
  "schema_version": "1.0.0",
  "mode": "OBSERVER",
  "governs_generation": false,
  "scene_id": "VSG2B-R2B-E-NEW-01",
  "source_identity": "R2B-191-E_SOURCE_SHA256_f0ba6e1f5bb5e3f40f39c0847f3d980e25c8c110b15b932cb1b3a10984a62860",
  "nodes": [
    {
      "id": "hidden_01",
      "type": "unknown_region",
      "source_kind": "OCCLUDED_REGION",
      "label": "unseen content behind foreground silhouette; no object identity or geometry asserted",
      "confidence": 0.35,
      "epistemic_class": "UNKNOWN",
      "observed": false,
      "locks": {
        "identity": false,
        "semantic": false,
        "geometry": false,
        "occlusion": true
      },
      "evidence": {
        "reference_id": "R2B-191-E_SOURCE_SHA256_f0ba6e1f5bb5e3f40f39c0847f3d980e25c8c110b15b932cb1b3a10984a62860",
        "region": [
          0.53,
          0.874,
          0.742,
          0.949
        ],
        "evidence_id": "E-OBS-hidden_01"
      },
      "properties": {
        "region_semantics": "screen-space non-revelation mask; not a claim about hidden geometry",
        "exact_content": "UNKNOWN",
        "reconstruction_authorized": false
      }
    },
    {
      "id": "left_facades_01",
      "type": "facade",
      "source_kind": "FACADE",
      "label": "visible left building facades; clipped at image boundary",
      "confidence": 0.9,
      "epistemic_class": "OBSERVED",
      "observed": true,
      "locks": {
        "identity": true,
        "semantic": false,
        "geometry": true,
        "occlusion": false
      },
      "evidence": {
        "reference_id": "R2B-191-E_SOURCE_SHA256_f0ba6e1f5bb5e3f40f39c0847f3d980e25c8c110b15b932cb1b3a10984a62860",
        "region": [
          0,
          0,
          0.438,
          0.872
        ],
        "evidence_id": "E-OBS-left_facades_01"
      }
    },
    {
      "id": "occluder_01",
      "type": "unclassified",
      "source_kind": "SURFACE",
      "label": "dark textured foreground silhouette; physical identity unassigned",
      "confidence": 0.9,
      "epistemic_class": "OBSERVED",
      "observed": true,
      "locks": {
        "identity": true,
        "semantic": false,
        "geometry": true,
        "occlusion": true
      },
      "evidence": {
        "reference_id": "R2B-191-E_SOURCE_SHA256_f0ba6e1f5bb5e3f40f39c0847f3d980e25c8c110b15b932cb1b3a10984a62860",
        "region": [
          0.496,
          0.819,
          0.79,
          0.969
        ],
        "evidence_id": "E-OBS-occluder_01"
      },
      "properties": {
        "silhouette_polygon": [
          [
            0.5,
            0.844
          ],
          [
            0.53,
            0.819
          ],
          [
            0.55,
            0.866
          ],
          [
            0.606,
            0.874
          ],
          [
            0.646,
            0.863
          ],
          [
            0.692,
            0.85
          ],
          [
            0.752,
            0.852
          ],
          [
            0.784,
            0.883
          ],
          [
            0.768,
            0.928
          ],
          [
            0.738,
            0.963
          ],
          [
            0.518,
            0.969
          ],
          [
            0.496,
            0.922
          ]
        ],
        "physical_identity": "UNASSIGNED"
      }
    },
    {
      "id": "right_facades_01",
      "type": "facade",
      "source_kind": "FACADE",
      "label": "visible right building facades; clipped at image boundary",
      "confidence": 0.9,
      "epistemic_class": "OBSERVED",
      "observed": true,
      "locks": {
        "identity": true,
        "semantic": false,
        "geometry": true,
        "occlusion": false
      },
      "evidence": {
        "reference_id": "R2B-191-E_SOURCE_SHA256_f0ba6e1f5bb5e3f40f39c0847f3d980e25c8c110b15b932cb1b3a10984a62860",
        "region": [
          0.638,
          0,
          1,
          0.861
        ],
        "evidence_id": "E-OBS-right_facades_01"
      }
    }
  ],
  "edges": [
    {
      "id": "rel_foreground_occludes_unknown",
      "type": "OCCLUDES",
      "from": "occluder_01",
      "to": "hidden_01",
      "confidence": 0.9,
      "protection": "PR0",
      "epistemic_class": "OBSERVED",
      "evidence": {
        "reference_id": "R2B-191-E_SOURCE_SHA256_f0ba6e1f5bb5e3f40f39c0847f3d980e25c8c110b15b932cb1b3a10984a62860",
        "region": [
          0.496,
          0.819,
          0.79,
          0.969
        ],
        "evidence_id": "E-OBS-rel_foreground_occludes_unknown"
      }
    }
  ],
  "reference_observations": [
    {
      "need_id": "SAR2-hidden_01",
      "target_node_id": "hidden_01",
      "result": "NO_QUERY_LOCKED_UNKNOWN",
      "evidence_unit_ids": [],
      "evidence_bundle_ids": [],
      "permitted_learning": [],
      "forbidden_transfer": [],
      "applied_transfers": []
    }
  ],
  "functional_subgraphs": [
    {
      "name": "semantic_text",
      "nodes": [],
      "edges": []
    },
    {
      "name": "rooftop",
      "nodes": [],
      "edges": []
    },
    {
      "name": "geometry",
      "nodes": [
        "left_facades_01",
        "right_facades_01"
      ],
      "edges": []
    },
    {
      "name": "occlusion",
      "nodes": [
        "hidden_01",
        "occluder_01"
      ],
      "edges": [
        "rel_foreground_occludes_unknown"
      ]
    }
  ],
  "diagnostics": {
    "unclassified_nodes": [
      "occluder_01"
    ],
    "unsupported_relations": [],
    "dangling_relations": []
  },
  "provenance": {
    "producer": "Streetcraft VSG-0 Observer",
    "sar_version": "SAR2",
    "rr_version": "RR2",
    "rr_status": "READY",
    "input_sha256": "92d4c158bbece87a2476f657a495bd5ac29f2a0b5a1dddd0fce4ccdc155544e7",
    "node_count": 4,
    "edge_count": 1
  },
  "graph_locks": {
    "version": "1.0.0",
    "mode": "VALIDATE_ONLY",
    "governs_generation": false,
    "items": [
      {
        "id": "GL-GEO-LEFT_FACADES_01",
        "type": "GEOMETRY_LOCK",
        "target": {
          "kind": "NODE",
          "id": "left_facades_01"
        },
        "strength": "ABSOLUTE",
        "enforcement": "VALIDATE_ONLY",
        "expected": {
          "node_type": "facade",
          "protected_topology": []
        },
        "provenance": {
          "source": "VSG_NODE_LOCK",
          "evidence": {
            "reference_id": "R2B-191-E_SOURCE_SHA256_f0ba6e1f5bb5e3f40f39c0847f3d980e25c8c110b15b932cb1b3a10984a62860",
            "region": [
              0,
              0,
              0.438,
              0.872
            ],
            "evidence_id": "E-OBS-left_facades_01"
          }
        }
      },
      {
        "id": "GL-GEO-OCCLUDER_01",
        "type": "GEOMETRY_LOCK",
        "target": {
          "kind": "NODE",
          "id": "occluder_01"
        },
        "strength": "ABSOLUTE",
        "enforcement": "VALIDATE_ONLY",
        "expected": {
          "node_type": "unclassified",
          "protected_topology": [
            {
              "id": "rel_foreground_occludes_unknown",
              "type": "OCCLUDES",
              "from": "occluder_01",
              "to": "hidden_01"
            }
          ]
        },
        "provenance": {
          "source": "VSG_NODE_LOCK",
          "evidence": {
            "reference_id": "R2B-191-E_SOURCE_SHA256_f0ba6e1f5bb5e3f40f39c0847f3d980e25c8c110b15b932cb1b3a10984a62860",
            "region": [
              0.496,
              0.819,
              0.79,
              0.969
            ],
            "evidence_id": "E-OBS-occluder_01"
          }
        }
      },
      {
        "id": "GL-GEO-RIGHT_FACADES_01",
        "type": "GEOMETRY_LOCK",
        "target": {
          "kind": "NODE",
          "id": "right_facades_01"
        },
        "strength": "ABSOLUTE",
        "enforcement": "VALIDATE_ONLY",
        "expected": {
          "node_type": "facade",
          "protected_topology": []
        },
        "provenance": {
          "source": "VSG_NODE_LOCK",
          "evidence": {
            "reference_id": "R2B-191-E_SOURCE_SHA256_f0ba6e1f5bb5e3f40f39c0847f3d980e25c8c110b15b932cb1b3a10984a62860",
            "region": [
              0.638,
              0,
              1,
              0.861
            ],
            "evidence_id": "E-OBS-right_facades_01"
          }
        }
      },
      {
        "id": "GL-OCC-REL_FOREGROUND_OCCLUDES_UNKNOWN",
        "type": "OCCLUSION_LOCK",
        "target": {
          "kind": "EDGE",
          "id": "rel_foreground_occludes_unknown"
        },
        "strength": "ABSOLUTE",
        "enforcement": "VALIDATE_ONLY",
        "expected": {
          "edge": {
            "id": "rel_foreground_occludes_unknown",
            "type": "OCCLUDES",
            "from": "occluder_01",
            "to": "hidden_01"
          },
          "protection": "PR0"
        },
        "provenance": {
          "source": "VSG_PROTECTED_RELATION",
          "evidence": {
            "reference_id": "R2B-191-E_SOURCE_SHA256_f0ba6e1f5bb5e3f40f39c0847f3d980e25c8c110b15b932cb1b3a10984a62860",
            "region": [
              0.496,
              0.819,
              0.79,
              0.969
            ],
            "evidence_id": "E-OBS-rel_foreground_occludes_unknown"
          }
        }
      }
    ],
    "summary": {
      "total": 4,
      "by_type": {
        "GEOMETRY_LOCK": 3,
        "OCCLUSION_LOCK": 1,
        "REFERENCE_ISOLATION_LOCK": 0,
        "SEMANTIC_TEXT_LOCK": 0
      },
      "warnings": []
    },
    "ledger_sha256": "3a7f179e4387885c11ee69f5e8f55e0bc9252ec2c92f066a72187860c7e8b149"
  }
}
